{
  "id": "evidence.example.hippocampus",
  "source_id": "source.example.placeholder",
  "source_type": "educational_resource",
  "evidence_type": "mixed",
  "species": "Homo sapiens",
  "methods": [],
  "relevant_entities": [
    "anatomy.region.hippocampus"
  ],
  "relevant_claims": [],
  "license": "REVIEW_REQUIRED",
  "notes": "Placeholder only. Do not treat as scientific evidence."
}
